{"acquisitionId":"33333333-3333-4333-8333-333333333333","acquisitionMode":{"baseline":true,"enrichmentRequested":false,"uiFallbackAllowed":false},"adapter":{"name":"Synthetic WhatsApp Adapter","sha256":"35ed6e41cf955cbbd9d2a6f1f2b822e196887fc4dbf43392d367a89d39cc9499","version":"1.0.0"},"authorization":{"confirmedAtUtc":"2026-01-15T08:00:00.000Z","reference":"SYNTHETIC-FIXTURE-AUTHORIZATION"},"collector":{"name":"Synthetic WAEB Fixture Builder","sha256":"5632f28d9762e9d18e42076dd04b9d043f8616ea17addb3d46045d27aae7b6f1","version":"1.0.0"},"environment":{"browser":{"debugTransport":"loopback_websocket","family":"chrome","profileMode":"authorized_existing","profileReferenceSha256":"efec51ff3b1e90af20443b04edc2f3a360087915860ada20be460b4bdc74255f","version":"synthetic"},"locale":"zh-Hans","os":{"architecture":"x86_64","family":"windows","version":"synthetic"},"timeZone":"Asia/Shanghai","whatsappBuild":"synthetic-build.invalid"},"evidenceId":"11111111-1111-4111-8111-111111111111","extensions":{"fixture.whatsapp-forensics.invalid":{"browserObservationBasis":"structure-only"}},"fixture":{"fixtureId":"minimal-valid-signed","generatorVersion":"1.0.0","seed":"waeb-fixture-seed-1"},"injector":{"name":"Synthetic Main World Injector","sha256":"63c6071d18a375d0b8b386880e95e6aa16eec07ceedabf7e69783efad083fa79","version":"1.0.0"},"log":{"eventCount":4,"path":"data/logs/acquisition.ndjson","terminalEventHash":"46ba292510dea65b70bc452b4d9f885be7f6bd155865d04405d7022a811bc41b"},"observationWindow":{"endedAtUtc":"2026-01-15T08:00:10.000Z","startedAtUtc":"2026-01-15T08:00:00.000Z"},"operator":{"displayName":"合成测试操作者","operatorId":"fixture_operator"},"portableConfiguration":{"assignmentId":"assignment-synthetic-fixture","assignmentSha256":"11fd6f66aa6dc1c76f8beaaf8824b42e6981814e678c92bebb8bd3d70c8b14f2","bundleId":"99999999-9999-4999-8999-999999999999","bundleManifestSha256":"b4f95abdb16b64ec49c7ef31a2b3416996bcfb06f5afe9bc3b31e8423703d6d8","workstationKeyFingerprintSha256":"sha256:765a12a98ec3837d065b5f5468884238e99c4faa73adca9d8893281c662c120f"},"privacy":{"normalizedWhitelist":true,"omittedFieldClasses":["media_keys","access_tokens","direct_urls","cookies","credentials","debug_secrets"],"restrictedRawIncluded":false},"schemaVersion":"1.0.0","sourceId":"22222222-2222-4222-8222-222222222222","synthetic":true,"waEvidenceBagVersion":"1.0.0-draft.1"}
